Question	Answer	Source	Metadata
hi	hello!!!	thu_ki_bot	editorial:chitchat
The Anh	Bạn vui lòng lấy số và xếp hàng chờ tới lượt được gặp síp ạ!	thu_ki_bot	editorial:chitchat
Thế Anh	Bạn vui lòng lấy số và xếp hàng chờ tới lượt được gặp síp ạ!	thu_ki_bot	editorial:chitchat
@RedzWM	Bạn vui lòng lấy số và xếp hàng chờ tới lượt được gặp síp ạ!	thu_ki_bot	editorial:chitchat
Do you ever get hurt?	I don't have a body.	thu_ki_bot	editorial:chitchat
AQADTgAD5IXYN3I Nhậu hả síp?  thu_ki_bot	editorial:chitchat
